{
  "$schema": "http://json-schema.org/draft-07/schema#",
  "title": "SpeakerAttribution",
  "type": "object",
  "required": ["verse", "subId", "speaker", "confidence"],
  "properties": {
    "verse": { "type": "integer", "minimum": 1 },
    "subId": { "type": "string", "pattern": "^[a-z]?$" },
    "speaker": { "type": "string", "minLength": 1 },
    "confidence": { "type": "number", "minimum": 0, "maximum": 1 },
    "rule": { "type": "string" },
    "ambiguous": { "type": "boolean" }
  }
}
