[
  {
    "verse": 7,
    "subId": "b",
    "speaker": "Multitud",
    "confidence": 0.9
  },
  {
    "verse": 8,
    "subId": "",
    "speaker": "Multitud",
    "confidence": 0.85
  },
  {
    "verse": 9,
    "subId": "",
    "speaker": "Multitud",
    "confidence": 0.85
  },
  {
    "verse": 10,
    "subId": "",
    "speaker": "Multitud",
    "confidence": 0.85
  },
  {
    "verse": 11,
    "subId": "",
    "speaker": "Multitud",
    "confidence": 0.85
  },
  {
    "verse": 12,
    "subId": "b",
    "speaker": "Multitud",
    "confidence": 0.9
  },
  {
    "verse": 13,
    "subId": "b",
    "speaker": "Multitud",
    "confidence": 0.85
  },
  {
    "verse": 15,
    "subId": "",
    "speaker": "Pedro",
    "confidence": 0.95
  },
  {
    "verse": 18,
    "subId": "",
    "speaker": "Dios",
    "confidence": 0.85
  },
  {
    "verse": 19,
    "subId": "",
    "speaker": "Dios",
    "confidence": 0.85
  },
  {
    "verse": 20,
    "subId": "",
    "speaker": "Dios",
    "confidence": 0.85
  },
  {
    "verse": 21,
    "subId": "",
    "speaker": "Dios",
    "confidence": 0.85
  },
  {
    "verse": 22,
    "subId": "",
    "speaker": "Pedro",
    "confidence": 0.95
  },
  {
    "verse": 23,
    "subId": "",
    "speaker": "Pedro",
    "confidence": 0.95
  },
  {
    "verse": 24,
    "subId": "",
    "speaker": "Pedro",
    "confidence": 0.95
  },
  {
    "verse": 25,
    "subId": "b",
    "speaker": "Pedro",
    "confidence": 0.9
  },
  {
    "verse": 26,
    "subId": "",
    "speaker": "Pedro",
    "confidence": 0.95
  },
  {
    "verse": 27,
    "subId": "",
    "speaker": "Pedro",
    "confidence": 0.95
  },
  {
    "verse": 28,
    "subId": "",
    "speaker": "Pedro",
    "confidence": 0.95
  },
  {
    "verse": 29,
    "subId": "",
    "speaker": "Pedro",
    "confidence": 0.95
  },
  {
    "verse": 30,
    "subId": "",
    "speaker": "Pedro",
    "confidence": 0.95
  },
  {
    "verse": 31,
    "subId": "",
    "speaker": "Pedro",
    "confidence": 0.95
  },
  {
    "verse": 32,
    "subId": "",
    "speaker": "Pedro",
    "confidence": 0.95
  },
  {
    "verse": 33,
    "subId": "",
    "speaker": "Pedro",
    "confidence": 0.95
  },
  {
    "verse": 34,
    "subId": "b",
    "speaker": "Pedro",
    "confidence": 0.9
  },
  {
    "verse": 35,
    "subId": "",
    "speaker": "Pedro",
    "confidence": 0.95
  },
  {
    "verse": 36,
    "subId": "",
    "speaker": "Pedro",
    "confidence": 0.95
  },
  {
    "verse": 37,
    "subId": "b",
    "speaker": "Multitud",
    "confidence": 0.85
  },
  {
    "verse": 39,
    "subId": "",
    "speaker": "Pedro",
    "confidence": 0.95
  },
  {
    "verse": 40,
    "subId": "b",
    "speaker": "Pedro",
    "confidence": 0.9
  }
]
