[
  {
    "verse": 2,
    "subId": "b",
    "speaker": "Mensajero",
    "confidence": 0.85
  },
  {
    "verse": 4,
    "subId": "b",
    "speaker": "Elías",
    "confidence": 0.85
  },
  {
    "verse": 5,
    "subId": "b",
    "speaker": "Ángel",
    "confidence": 0.85
  },
  {
    "verse": 7,
    "subId": "b",
    "speaker": "Ángel",
    "confidence": 0.85
  },
  {
    "verse": 9,
    "subId": "b",
    "speaker": "Dios",
    "confidence": 0.85
  },
  {
    "verse": 10,
    "subId": "b",
    "speaker": "Elías",
    "confidence": 0.85
  },
  {
    "verse": 11,
    "subId": "b",
    "speaker": "Dios",
    "confidence": 0.85
  },
  {
    "verse": 12,
    "subId": "",
    "speaker": "Narrador",
    "confidence": 0.85
  },
  {
    "verse": 14,
    "subId": "b",
    "speaker": "Elías",
    "confidence": 0.85
  },
  {
    "verse": 16,
    "subId": "",
    "speaker": "Dios",
    "confidence": 0.85
  },
  {
    "verse": 17,
    "subId": "",
    "speaker": "Dios",
    "confidence": 0.85
  },
  {
    "verse": 18,
    "subId": "",
    "speaker": "Dios",
    "confidence": 0.85
  },
  {
    "verse": 19,
    "subId": "",
    "speaker": "Narrador",
    "confidence": 0.85
  },
  {
    "verse": 20,
    "subId": "b",
    "speaker": "Eliseo",
    "confidence": 0.85
  },
  {
    "verse": 20,
    "subId": "d",
    "speaker": "Elías",
    "confidence": 0.85
  },
  {
    "verse": 21,
    "subId": "",
    "speaker": "Narrador",
    "confidence": 0.85
  },
  {
    "verse": 13,
    "subId": "b",
    "speaker": "Dios",
    "confidence": 0.85
  }
]