[
  {
    "verse": 2,
    "subId": "b",
    "speaker": "Multitud",
    "confidence": 0.85
  },
  {
    "verse": 3,
    "subId": "",
    "speaker": "Multitud",
    "confidence": 0.85
  },
  {
    "verse": 10,
    "subId": "b",
    "speaker": "Jesús",
    "confidence": 0.9
  },
  {
    "verse": 14,
    "subId": "b",
    "speaker": "Herodes",
    "confidence": 0.9
  },
  {
    "verse": 15,
    "subId": "b",
    "speaker": "Multitud",
    "confidence": 0.85
  },
  {
    "verse": 15,
    "subId": "d",
    "speaker": "Multitud",
    "confidence": 0.85
  },
  {
    "verse": 18,
    "subId": "b",
    "speaker": "Juan el Bautista",
    "confidence": 0.9
  },
  {
    "verse": 22,
    "subId": "b",
    "speaker": "Herodes",
    "confidence": 0.9
  },
  {
    "verse": 24,
    "subId": "b",
    "speaker": "Hija de Herodías",
    "confidence": 0.85
  },
  {
    "verse": 24,
    "subId": "d",
    "speaker": "Herodías",
    "confidence": 0.9
  },
  {
    "verse": 25,
    "subId": "b",
    "speaker": "Hija de Herodías",
    "confidence": 0.85
  },
  {
    "verse": 31,
    "subId": "b",
    "speaker": "Jesús",
    "confidence": 0.9
  },
  {
    "verse": 35,
    "subId": "b",
    "speaker": "Discípulos",
    "confidence": 0.9
  },
  {
    "verse": 37,
    "subId": "b",
    "speaker": "Jesús",
    "confidence": 0.9
  },
  {
    "verse": 37,
    "subId": "d",
    "speaker": "Discípulos",
    "confidence": 0.85
  },
  {
    "verse": 38,
    "subId": "b",
    "speaker": "Jesús",
    "confidence": 0.9
  },
  {
    "verse": 38,
    "subId": "d",
    "speaker": "Discípulos",
    "confidence": 0.85
  },
  {
    "verse": 50,
    "subId": "b",
    "speaker": "Jesús",
    "confidence": 0.9
  },
  {
    "verse": 11,
    "subId": "",
    "speaker": "Jesús",
    "confidence": 0.85
  },
  {
    "verse": 23,
    "subId": "",
    "speaker": "Herodes",
    "confidence": 0.85
  }
]