[
  {
    "verse": 1,
    "subId": "",
    "speaker": "Moisés",
    "confidence": 0.8
  },
  {
    "verse": 2,
    "subId": "",
    "speaker": "Moisés",
    "confidence": 0.8
  },
  {
    "verse": 3,
    "subId": "",
    "speaker": "Moisés",
    "confidence": 0.8
  },
  {
    "verse": 4,
    "subId": "",
    "speaker": "Moisés",
    "confidence": 0.8
  },
  {
    "verse": 5,
    "subId": "",
    "speaker": "Moisés",
    "confidence": 0.8
  },
  {
    "verse": 6,
    "subId": "",
    "speaker": "Moisés",
    "confidence": 0.8
  },
  {
    "verse": 7,
    "subId": "",
    "speaker": "Moisés",
    "confidence": 0.8
  },
  {
    "verse": 8,
    "subId": "",
    "speaker": "Moisés",
    "confidence": 0.8
  },
  {
    "verse": 9,
    "subId": "",
    "speaker": "Moisés",
    "confidence": 0.8
  },
  {
    "verse": 10,
    "subId": "",
    "speaker": "Moisés",
    "confidence": 0.8
  },
  {
    "verse": 11,
    "subId": "",
    "speaker": "Moisés",
    "confidence": 0.8
  },
  {
    "verse": 12,
    "subId": "",
    "speaker": "Moisés",
    "confidence": 0.8
  },
  {
    "verse": 13,
    "subId": "",
    "speaker": "Moisés",
    "confidence": 0.8
  },
  {
    "verse": 14,
    "subId": "",
    "speaker": "Moisés",
    "confidence": 0.8
  },
  {
    "verse": 15,
    "subId": "",
    "speaker": "Moisés",
    "confidence": 0.8
  },
  {
    "verse": 16,
    "subId": "",
    "speaker": "Moisés",
    "confidence": 0.8
  },
  {
    "verse": 17,
    "subId": "",
    "speaker": "Moisés",
    "confidence": 0.8
  },
  {
    "verse": 18,
    "subId": "",
    "speaker": "Moisés",
    "confidence": 0.8
  },
  {
    "verse": 19,
    "subId": "",
    "speaker": "Moisés",
    "confidence": 0.8
  },
  {
    "verse": 20,
    "subId": "",
    "speaker": "Moisés",
    "confidence": 0.8
  },
  {
    "verse": 21,
    "subId": "",
    "speaker": "Moisés",
    "confidence": 0.8
  },
  {
    "verse": 22,
    "subId": "",
    "speaker": "Moisés",
    "confidence": 0.8
  },
  {
    "verse": 23,
    "subId": "",
    "speaker": "Moisés",
    "confidence": 0.8
  }
]