[
  {
    "verse": 2,
    "subId": "b",
    "speaker": "David",
    "confidence": 0.85
  },
  {
    "verse": 6,
    "subId": "",
    "speaker": "Dios",
    "confidence": 0.85
  },
  {
    "verse": 9,
    "subId": "",
    "speaker": "Dios",
    "confidence": 0.85
  },
  {
    "verse": 10,
    "subId": "",
    "speaker": "Dios",
    "confidence": 0.85
  },
  {
    "verse": 11,
    "subId": "",
    "speaker": "Dios",
    "confidence": 0.85
  },
  {
    "verse": 12,
    "subId": "",
    "speaker": "Dios",
    "confidence": 0.85
  },
  {
    "verse": 13,
    "subId": "",
    "speaker": "Dios",
    "confidence": 0.85
  },
  {
    "verse": 14,
    "subId": "",
    "speaker": "Dios",
    "confidence": 0.85
  },
  {
    "verse": 15,
    "subId": "",
    "speaker": "Dios",
    "confidence": 0.85
  },
  {
    "verse": 16,
    "subId": "",
    "speaker": "Dios",
    "confidence": 0.85
  },
  {
    "verse": 17,
    "subId": "",
    "speaker": "Narrador",
    "confidence": 0.85
  },
  {
    "verse": 18,
    "subId": "b",
    "speaker": "David",
    "confidence": 0.85
  },
  {
    "verse": 19,
    "subId": "",
    "speaker": "David",
    "confidence": 0.85
  },
  {
    "verse": 20,
    "subId": "",
    "speaker": "David",
    "confidence": 0.85
  },
  {
    "verse": 23,
    "subId": "",
    "speaker": "David",
    "confidence": 0.85
  },
  {
    "verse": 24,
    "subId": "",
    "speaker": "David",
    "confidence": 0.85
  },
  {
    "verse": 25,
    "subId": "",
    "speaker": "David",
    "confidence": 0.85
  },
  {
    "verse": 26,
    "subId": "",
    "speaker": "David",
    "confidence": 0.85
  },
  {
    "verse": 27,
    "subId": "b",
    "speaker": "David",
    "confidence": 0.85
  },
  {
    "verse": 28,
    "subId": "",
    "speaker": "David",
    "confidence": 0.85
  },
  {
    "verse": 29,
    "subId": "",
    "speaker": "David",
    "confidence": 0.85
  }
]