[
  {
    "verse": 15,
    "subId": "b",
    "speaker": "Hilcías",
    "confidence": 0.85
  },
  {
    "verse": 16,
    "subId": "b",
    "speaker": "Safán",
    "confidence": 0.85
  },
  {
    "verse": 18,
    "subId": "b",
    "speaker": "Safán",
    "confidence": 0.85
  },
  {
    "verse": 23,
    "subId": "b",
    "speaker": "Hulda",
    "confidence": 0.85
  },
  {
    "verse": 25,
    "subId": "",
    "speaker": "Hulda",
    "confidence": 0.85
  },
  {
    "verse": 26,
    "subId": "b",
    "speaker": "Hulda",
    "confidence": 0.85
  },
  {
    "verse": 27,
    "subId": "",
    "speaker": "Hulda",
    "confidence": 0.85
  },
  {
    "verse": 28,
    "subId": "",
    "speaker": "Hulda",
    "confidence": 0.85
  },
  {
    "verse": 29,
    "subId": "",
    "speaker": "Narrador",
    "confidence": 0.85
  }
]