[
  {
    "verse": 1,
    "subId": "",
    "speaker": "Narrador",
    "confidence": 0.85
  },
  {
    "verse": 2,
    "subId": "",
    "speaker": "Narrador",
    "confidence": 0.85
  },
  {
    "verse": 3,
    "subId": "",
    "speaker": "Narrador",
    "confidence": 0.85
  },
  {
    "verse": 4,
    "subId": "",
    "speaker": "Narrador",
    "confidence": 0.85
  },
  {
    "verse": 5,
    "subId": "",
    "speaker": "Narrador",
    "confidence": 0.85
  },
  {
    "verse": 6,
    "subId": "",
    "speaker": "Narrador",
    "confidence": 0.85
  },
  {
    "verse": 7,
    "subId": "a",
    "speaker": "Narrador",
    "confidence": 0.85
  },
  {
    "verse": 7,
    "subId": "b",
    "speaker": "Belsasar",
    "confidence": 0.9
  },
  {
    "verse": 8,
    "subId": "",
    "speaker": "Narrador",
    "confidence": 0.85
  },
  {
    "verse": 9,
    "subId": "",
    "speaker": "Narrador",
    "confidence": 0.85
  },
  {
    "verse": 10,
    "subId": "a",
    "speaker": "Narrador",
    "confidence": 0.85
  },
  {
    "verse": 10,
    "subId": "b",
    "speaker": "Reina",
    "confidence": 0.9
  },
  {
    "verse": 11,
    "subId": "",
    "speaker": "Reina",
    "confidence": 0.9
  },
  {
    "verse": 12,
    "subId": "",
    "speaker": "Reina",
    "confidence": 0.9
  },
  {
    "verse": 13,
    "subId": "a",
    "speaker": "Narrador",
    "confidence": 0.85
  },
  {
    "verse": 13,
    "subId": "b",
    "speaker": "Belsasar",
    "confidence": 0.9
  },
  {
    "verse": 14,
    "subId": "",
    "speaker": "Belsasar",
    "confidence": 0.9
  },
  {
    "verse": 15,
    "subId": "",
    "speaker": "Belsasar",
    "confidence": 0.9
  },
  {
    "verse": 16,
    "subId": "",
    "speaker": "Belsasar",
    "confidence": 0.9
  },
  {
    "verse": 17,
    "subId": "a",
    "speaker": "Narrador",
    "confidence": 0.85
  },
  {
    "verse": 17,
    "subId": "b",
    "speaker": "Daniel",
    "confidence": 0.9
  },
  {
    "verse": 18,
    "subId": "",
    "speaker": "Daniel",
    "confidence": 0.9
  },
  {
    "verse": 19,
    "subId": "",
    "speaker": "Daniel",
    "confidence": 0.9
  },
  {
    "verse": 20,
    "subId": "",
    "speaker": "Daniel",
    "confidence": 0.9
  },
  {
    "verse": 21,
    "subId": "",
    "speaker": "Daniel",
    "confidence": 0.9
  },
  {
    "verse": 22,
    "subId": "",
    "speaker": "Daniel",
    "confidence": 0.9
  },
  {
    "verse": 23,
    "subId": "",
    "speaker": "Daniel",
    "confidence": 0.9
  },
  {
    "verse": 24,
    "subId": "",
    "speaker": "Daniel",
    "confidence": 0.9
  },
  {
    "verse": 25,
    "subId": "",
    "speaker": "Daniel",
    "confidence": 0.9
  },
  {
    "verse": 26,
    "subId": "",
    "speaker": "Daniel",
    "confidence": 0.9
  },
  {
    "verse": 27,
    "subId": "",
    "speaker": "Daniel",
    "confidence": 0.9
  },
  {
    "verse": 28,
    "subId": "",
    "speaker": "Daniel",
    "confidence": 0.9
  },
  {
    "verse": 29,
    "subId": "",
    "speaker": "Narrador",
    "confidence": 0.85
  },
  {
    "verse": 30,
    "subId": "",
    "speaker": "Narrador",
    "confidence": 0.85
  },
  {
    "verse": 31,
    "subId": "",
    "speaker": "Narrador",
    "confidence": 0.85
  }
]
