[
  {
    "verse": 2,
    "subId": "b",
    "speaker": "Sacerdotes",
    "confidence": 0.85
  },
  {
    "verse": 4,
    "subId": "b",
    "speaker": "Discípulos",
    "confidence": 0.8
  },
  {
    "verse": 14,
    "subId": "b",
    "speaker": "Jesús",
    "confidence": 0.9
  },
  {
    "verse": 19,
    "subId": "b",
    "speaker": "Discípulos",
    "confidence": 0.85
  },
  {
    "verse": 20,
    "subId": "b",
    "speaker": "Jesús",
    "confidence": 0.9
  },
  {
    "verse": 21,
    "subId": "",
    "speaker": "Jesús",
    "confidence": 0.9
  },
  {
    "verse": 24,
    "subId": "b",
    "speaker": "Jesús",
    "confidence": 0.9
  },
  {
    "verse": 44,
    "subId": "b",
    "speaker": "Judas",
    "confidence": 0.85
  },
  {
    "verse": 45,
    "subId": "b",
    "speaker": "Judas",
    "confidence": 0.85
  },
  {
    "verse": 58,
    "subId": "b",
    "speaker": "Testigos",
    "confidence": 0.9
  },
  {
    "verse": 67,
    "subId": "b",
    "speaker": "Criada",
    "confidence": 0.85
  },
  {
    "verse": 68,
    "subId": "b",
    "speaker": "Pedro",
    "confidence": 0.9
  },
  {
    "verse": 70,
    "subId": "b",
    "speaker": "Multitud",
    "confidence": 0.85
  },
  {
    "verse": 32,
    "subId": "b",
    "speaker": "Jesús",
    "confidence": 0.9
  },
  {
    "verse": 34,
    "subId": "b",
    "speaker": "Jesús",
    "confidence": 0.9
  },
  {
    "verse": 36,
    "subId": "b",
    "speaker": "Jesús",
    "confidence": 0.9
  },
  {
    "verse": 37,
    "subId": "b",
    "speaker": "Jesús",
    "confidence": 0.9
  },
  {
    "verse": 41,
    "subId": "b",
    "speaker": "Jesús",
    "confidence": 0.9
  },
  {
    "verse": 7,
    "subId": "",
    "speaker": "Jesús",
    "confidence": 0.85
  },
  {
    "verse": 15,
    "subId": "",
    "speaker": "Jesús",
    "confidence": 0.85
  },
  {
    "verse": 25,
    "subId": "",
    "speaker": "Jesús",
    "confidence": 0.85
  },
  {
    "verse": 28,
    "subId": "",
    "speaker": "Jesús",
    "confidence": 0.85
  },
  {
    "verse": 42,
    "subId": "",
    "speaker": "Jesús",
    "confidence": 0.85
  },
  {
    "verse": 49,
    "subId": "",
    "speaker": "Jesús",
    "confidence": 0.85
  },
  {
    "verse": 64,
    "subId": "",
    "speaker": "Sumo sacerdote",
    "confidence": 0.85
  }
]