[
  {
    "verse": 1,
    "subId": "b",
    "speaker": "Jesús",
    "confidence": 0.9
  },
  {
    "verse": 2,
    "subId": "",
    "speaker": "Jesús",
    "confidence": 0.9
  },
  {
    "verse": 3,
    "subId": "",
    "speaker": "Jesús",
    "confidence": 0.9
  },
  {
    "verse": 4,
    "subId": "",
    "speaker": "Jesús",
    "confidence": 0.9
  },
  {
    "verse": 5,
    "subId": "",
    "speaker": "Jesús",
    "confidence": 0.9
  },
  {
    "verse": 6,
    "subId": "",
    "speaker": "Jesús",
    "confidence": 0.9
  },
  {
    "verse": 7,
    "subId": "a",
    "speaker": "Narrador",
    "confidence": 0.9
  },
  {
    "verse": 8,
    "subId": "",
    "speaker": "Jesús",
    "confidence": 0.9
  },
  {
    "verse": 9,
    "subId": "",
    "speaker": "Jesús",
    "confidence": 0.9
  },
  {
    "verse": 10,
    "subId": "",
    "speaker": "Jesús",
    "confidence": 0.9
  },
  {
    "verse": 11,
    "subId": "",
    "speaker": "Jesús",
    "confidence": 0.9
  },
  {
    "verse": 12,
    "subId": "",
    "speaker": "Jesús",
    "confidence": 0.9
  },
  {
    "verse": 13,
    "subId": "",
    "speaker": "Jesús",
    "confidence": 0.9
  },
  {
    "verse": 15,
    "subId": "",
    "speaker": "Jesús",
    "confidence": 0.9
  },
  {
    "verse": 16,
    "subId": "",
    "speaker": "Jesús",
    "confidence": 0.9
  },
  {
    "verse": 17,
    "subId": "b",
    "speaker": "Narrador",
    "confidence": 0.9
  },
  {
    "verse": 18,
    "subId": "",
    "speaker": "Jesús",
    "confidence": 0.9
  },
  {
    "verse": 19,
    "subId": "",
    "speaker": "Jesús",
    "confidence": 0.9
  },
  {
    "verse": 20,
    "subId": "",
    "speaker": "Jesús",
    "confidence": 0.9
  },
  {
    "verse": 21,
    "subId": "",
    "speaker": "Jesús",
    "confidence": 0.9
  },
  {
    "verse": 22,
    "subId": "",
    "speaker": "Jesús",
    "confidence": 0.9
  }
]