[
  {
    "verse": 3,
    "subId": "b",
    "speaker": "Jesús",
    "confidence": 0.9
  },
  {
    "verse": 11,
    "subId": "b",
    "speaker": "Jesús",
    "confidence": 0.9
  },
  {
    "verse": 14,
    "subId": "b",
    "speaker": "Jesús",
    "confidence": 0.85
  },
  {
    "verse": 24,
    "subId": "b",
    "speaker": "Jesús",
    "confidence": 0.9
  },
  {
    "verse": 28,
    "subId": "b",
    "speaker": "Jesús",
    "confidence": 0.85
  },
  {
    "verse": 29,
    "subId": "b",
    "speaker": "Jesús",
    "confidence": 0.9
  },
  {
    "verse": 31,
    "subId": "b",
    "speaker": "Jesús",
    "confidence": 0.9
  },
  {
    "verse": 33,
    "subId": "b",
    "speaker": "Jesús",
    "confidence": 0.9
  },
  {
    "verse": 35,
    "subId": "b",
    "speaker": "Narrador",
    "confidence": 0.9
  },
  {
    "verse": 37,
    "subId": "b",
    "speaker": "Jesús",
    "confidence": 0.9
  },
  {
    "verse": 51,
    "subId": "d",
    "speaker": "Discípulos",
    "confidence": 0.85
  },
  {
    "verse": 52,
    "subId": "b",
    "speaker": "Jesús",
    "confidence": 0.9
  },
  {
    "verse": 54,
    "subId": "b",
    "speaker": "Multitud",
    "confidence": 0.85
  },
  {
    "verse": 55,
    "subId": "",
    "speaker": "Multitud",
    "confidence": 0.8
  },
  {
    "verse": 56,
    "subId": "",
    "speaker": "Multitud",
    "confidence": 0.8
  },
  {
    "verse": 27,
    "subId": "b",
    "speaker": "Jesús",
    "confidence": 0.8
  },
  {
    "verse": 28,
    "subId": "d",
    "speaker": "Jesús",
    "confidence": 0.8
  },
  {
    "verse": 30,
    "subId": "",
    "speaker": "Jesús",
    "confidence": 0.85
  }
]