[
  {
    "verse": 2,
    "subId": "b",
    "speaker": "Moisés",
    "confidence": 0.85
  },
  {
    "verse": 3,
    "subId": "",
    "speaker": "Moisés",
    "confidence": 0.8
  },
  {
    "verse": 4,
    "subId": "",
    "speaker": "Moisés",
    "confidence": 0.8
  },
  {
    "verse": 5,
    "subId": "",
    "speaker": "Moisés",
    "confidence": 0.8
  },
  {
    "verse": 6,
    "subId": "",
    "speaker": "Moisés",
    "confidence": 0.8
  },
  {
    "verse": 7,
    "subId": "a",
    "speaker": "Moisés",
    "confidence": 0.8
  },
  {
    "verse": 8,
    "subId": "",
    "speaker": "Moisés",
    "confidence": 0.8
  },
  {
    "verse": 11,
    "subId": "",
    "speaker": "Moisés",
    "confidence": 0.8
  },
  {
    "verse": 12,
    "subId": "",
    "speaker": "Moisés",
    "confidence": 0.8
  },
  {
    "verse": 13,
    "subId": "",
    "speaker": "Moisés",
    "confidence": 0.8
  },
  {
    "verse": 15,
    "subId": "",
    "speaker": "Moisés",
    "confidence": 0.8
  },
  {
    "verse": 18,
    "subId": "",
    "speaker": "Moisés",
    "confidence": 0.8
  },
  {
    "verse": 19,
    "subId": "",
    "speaker": "Moisés",
    "confidence": 0.8
  },
  {
    "verse": 20,
    "subId": "",
    "speaker": "Moisés",
    "confidence": 0.8
  },
  {
    "verse": 21,
    "subId": "",
    "speaker": "Moisés",
    "confidence": 0.8
  },
  {
    "verse": 22,
    "subId": "",
    "speaker": "Narrador",
    "confidence": 0.85
  },
  {
    "verse": 24,
    "subId": "",
    "speaker": "Moisés",
    "confidence": 0.8
  },
  {
    "verse": 26,
    "subId": "",
    "speaker": "Moisés",
    "confidence": 0.8
  },
  {
    "verse": 27,
    "subId": "",
    "speaker": "Moisés",
    "confidence": 0.85
  },
  {
    "verse": 28,
    "subId": "",
    "speaker": "Moisés",
    "confidence": 0.8
  },
  {
    "verse": 29,
    "subId": "",
    "speaker": "Moisés",
    "confidence": 0.8
  },
  {
    "verse": 30,
    "subId": "",
    "speaker": "Narrador",
    "confidence": 0.85
  }
]
