[
  {
    "verse": 3,
    "subId": "b",
    "speaker": "Discípulos",
    "confidence": 0.85
  },
  {
    "verse": 17,
    "subId": "b",
    "speaker": "Jesús",
    "confidence": 0.9
  },
  {
    "verse": 18,
    "subId": "b",
    "speaker": "Jesús",
    "confidence": 0.85
  },
  {
    "verse": 19,
    "subId": "b",
    "speaker": "Jesús",
    "confidence": 0.9
  },
  {
    "verse": 8,
    "subId": "",
    "speaker": "Jesús",
    "confidence": 0.85
  },
  {
    "verse": 21,
    "subId": "",
    "speaker": "Jesús",
    "confidence": 0.85
  }
]