[
  {
    "verse": 2,
    "subId": "b",
    "speaker": "Jesús",
    "confidence": 0.9
  },
  {
    "verse": 7,
    "subId": "b",
    "speaker": "Discípulos",
    "confidence": 0.85
  },
  {
    "verse": 9,
    "subId": "",
    "speaker": "Jesús",
    "confidence": 0.85
  },
  {
    "verse": 10,
    "subId": "",
    "speaker": "Jesús",
    "confidence": 0.85
  },
  {
    "verse": 11,
    "subId": "",
    "speaker": "Fariseos",
    "confidence": 0.85
  },
  {
    "verse": 12,
    "subId": "",
    "speaker": "Narrador",
    "confidence": 0.85
  },
  {
    "verse": 14,
    "subId": "b",
    "speaker": "Discípulos",
    "confidence": 0.85
  },
  {
    "verse": 15,
    "subId": "b",
    "speaker": "Jesús",
    "confidence": 0.9
  },
  {
    "verse": 18,
    "subId": "",
    "speaker": "Jesús",
    "confidence": 0.9
  },
  {
    "verse": 19,
    "subId": "",
    "speaker": "Jesús",
    "confidence": 0.9
  },
  {
    "verse": 23,
    "subId": "b",
    "speaker": "Jesús",
    "confidence": 0.9
  },
  {
    "verse": 25,
    "subId": "",
    "speaker": "Jesús",
    "confidence": 0.9
  },
  {
    "verse": 26,
    "subId": "",
    "speaker": "Jesús",
    "confidence": 0.9
  }
]
